{
  "name": "BookingBot",
  "description": "A simple hotel room booking bot",
  "type": "Bot",
  "idle_session_ttl": 300,
  "child_directed": false,
  "locales": {
    "en_US": {
      "confidence_threshold": 0.4,
      "voice_settings": {
        "voice_id": "Joanna",
        "engine": "neural"
      },
      "slot_types": {
        "RoomType": {
          "description": "Available room categories",
          "value_selection_strategy": "TopResolution",
          "values": [
            {
              "value": "single",
              "synonyms": [
                "single room",
                "one bed"
              ]
            },
            {
              "value": "double",
              "synonyms": [
                "double room",
                "two beds"
              ]
            },
            {
              "value": "suite",
              "synonyms": [
                "suite room",
                "luxury"
              ]
            }
          ]
        }
      },
      "intents": {
        "BookRoom": {
          "description": "Handles hotel room booking requests",
          "sample_utterances": [
            "I want to book a room",
            "Reserve a room for me",
            "I need a hotel room",
            "Make a reservation"
          ],
          "confirmation_prompt": {
            "message": "Just to confirm — you want a {RoomType} room checking in on {CheckInDate} for {Nights} nights. Is that right?",
            "max_retries": 2,
            "message_selection_strategy": "Ordered"
          },
          "confirmation_response": {
            "message": "Great, your booking is confirmed. You will receive a confirmation email shortly."
          },
          "declination_response": {
            "message": "No problem. Let me know if you would like to make a different booking."
          },
          "closing_prompt": {
            "message": "Thank you for choosing us. Is there anything else I can help you with?"
          },
          "slots": {
            "RoomType": {
              "description": "Type of room to book",
              "slot_type": "RoomType",
              "required": true,
              "prompt": "What type of room would you like — single, double, or suite?"
            },
            "CheckInDate": {
              "description": "Check-in date",
              "slot_type": "AMAZON.Date",
              "required": true,
              "prompt": "What date would you like to check in?"
            },
            "Nights": {
              "description": "Number of nights to stay",
              "slot_type": "AMAZON.Number",
              "required": true,
              "prompt": "How many nights will you be staying?"
            }
          }
        },
        "CancelBooking": {
          "description": "Cancels an existing booking",
          "sample_utterances": [
            "Cancel my booking",
            "I want to cancel my reservation",
            "Please cancel my room"
          ],
          "confirmation_prompt": {
            "message": "Are you sure you want to cancel your booking with reference {BookingRef}?",
            "max_retries": 1
          },
          "confirmation_response": {
            "message": "Your booking has been cancelled."
          },
          "declination_response": {
            "message": "Your booking has not been cancelled. Let me know if you need anything else."
          },
          "slots": {
            "BookingRef": {
              "description": "Booking reference number",
              "slot_type": "AMAZON.AlphaNumeric",
              "required": true,
              "prompt": "Please provide your booking reference number."
            }
          }
        }
      }
    }
  }
}